{
  "name": "Security Scan Workflow",
  "description": "Comprehensive security vulnerability detection using static analysis. Finds SQL injection, XSS, leaked secrets, insecure dependencies, and authentication issues.",
  "lanes": [
    {
      "id": "security-scan",
      "agentFile": "security-agent.json",
      "supervisorFile": "security-supervisor.json",
      "dependsOn": [],
      "capabilities": ["security-analysis", "vulnerability-detection", "secret-scanning"]
    }
  ],
  "globalBarriers": [],
  "capabilityRegistry": {
    "security-analysis": ["security-scan"],
    "vulnerability-detection": ["security-scan"],
    "secret-scanning": ["security-scan"]
  },
  "modelRouterFile": "model-router.json"
}
